{
  "$schema": "https://json-schema.org/draft/2020-12/schema",
  "title": "HBN Hearback Record",
  "description": "Confirmacao humana de um readback. Sem este artefato com status='confirmed', nenhuma onda safe_track pode escrever em codigo. Status: proposed (C3 2026-06-10, aguardando hearback). Promovido de Credenciamento/.hbn/schemas/hearback (v1.0.0, doutrina viva medida em campo); generalizado: enums de agente/assinante sao pinados por projeto.",
  "type": "object",
  "additionalProperties": false,
  "required": [
    "hearback_id",
    "readback_id",
    "status",
    "signed_by",
    "signed_at"
  ],
  "properties": {
    "hearback_id": {
      "type": "string",
      "pattern": "^[0-9]{4}-[a-z0-9-]+$"
    },
    "readback_id": {
      "type": "string",
      "pattern": "^[0-9]{4}-[a-z0-9-]+$",
      "description": "Deve corresponder ao readback_id em .hbn/readbacks/."
    },
    "status": {
      "type": "string",
      "enum": ["confirmed", "rejected", "request_changes"],
      "description": "confirmed = a IA esta autorizada a executar exatamente o que o readback declara. rejected = onda cancelada. request_changes = readback precisa ser refeito antes de nova tentativa."
    },
    "signed_by": {
      "type": "string",
      "minLength": 1,
      "description": "Quem assinou. A root of trust default e o operador humano do projeto (ex.: mauricio-zanin); delegacao exige grant explicito registrado. Projetos DEVEM restringir a enum no schema local."
    },
    "signed_at": {
      "type": "string",
      "format": "date-time"
    },
    "notes": {
      "type": "string",
      "description": "Razao da decisao, condicoes adicionais, escopo mais estreito que o readback original."
    },
    "scope_overrides": {
      "type": "object",
      "additionalProperties": false,
      "properties": {
        "files_allowed_subset": {
          "type": "array",
          "items": { "type": "string" },
          "description": "Se preenchido, restringe ainda mais o scope.files_allowed do readback. Nao pode expandir."
        }
      }
    }
  }
}
